"sheets.players.Rank","sheets.players.Last.year","sheets.players.Up.or.down","sheets.players.Name","sheets.players.Position","sheets.players.Club.on.20.Dec.2018","sheets.players.League","sheets.players.Age.on.20.Dec.2018","sheets.players.Nationality","sheets.players.Filters","sheets.players.Image.found","sheets.players.Video.Path","sheets.players.Facewall.cell.image.GRID.src","sheets.players.Facewall.cell.image.GRID.attributes","sheets.players.Facewall.main.image.GRID.src","sheets.players.Facewall.main.image.GRID.attributes","sheets.players.","sheets.players.Profile","sheets.players.Writer","sheets.players.Words","sheets.players.Desked.by","sheets.players.To.be.subbed.by","sheets.players.Subbed","sheets.players.Revised","sheets.furniture.headline","sheets.furniture.standfirst","sheets.furniture.pagestrap","sheets.furniture.shareurl"
"71","","New entry","Benjamin Pavard","Defender","Stuttgart","Germany","22","France","French, Bundesliga, Defenders","","","https://media.guim.co.uk/7f3aea20b503114ec532fb4e8d5c811393128a5d/1413_161_1172_1172","cropRatio=1172,1172&size=140,500,1000,1172","https://media.guim.co.uk/bed842f4e5e306e4822319f434b1fb64a6cb8dce/0_52_2412_1447","cropRatio=2412,1447&size=140,500,1000,2000,2412","","Twelve months ago Pavard had just made his debut for France’s seniors, singing Daniel Balavoine’s Le Chanteur for his inauguration – and changing the “je m’appelle Henri” line to “je m’appelle Benji”. That is the 22-year-old’s success in a nutshell. He adapts, as he did so well when making an unlikely move from Lille to Germany’s second-tier with Stuttgart. A standout at centre-back in the Bundesliga post-promotion, he stepped in to star at the World Cup out of position at right-back, even scoring <a href=""https://www.theguardian.com/football/2018/jun/30/france-argentina-world-cup-last-16-match-report"">one of the goals of the tournament against Argentina</a>. Some post-World Cup win blues at Stuttgart can’t hide his quality.","Andy Brassell","","","","","","Top 100 footballers 2017:the best talents in the world","The Guardian picks the best prospect from each club born between 1 September 2000 and 31 August 2001, an age band known as first-year scholars. Check the progress of our <a href=""https://www.theguardian.com/football/ng-interactive/2016/oct/04/next-generation-2016-20-of-the-best-talents-at-premier-league-clubs"" target=""_new"">2016 class</a> | <a href=""https://www.theguardian.com/football/ng-interactive/2015/oct/06/next-generation-2015-20-of-the-best-talents-at-premier-league-clubs"" target=""_new"">2015</a> | <a href=""https://www.theguardian.com/football/blog/ng-interactive/2014/oct/13/next-generation-2014-20-of-the-best-talents-at-premier-league-clubs"" target=""_new"">2014</a>","<a href=""https://www.theguardian.com/football"" target=""_new"">Football</a>",""
"72","","New entry","Kieran Trippier","Defender","Tottenham Hotspur","England","28","England","English, Premier League, Defenders","","","https://media.guim.co.uk/16cf65513728debed8c0d5b0516071fc36834c41/1095_182_2496_2495","cropRatio=2496,2495&size=140,500,1000,2000,2496","https://media.guim.co.uk/c17560bda396282e5c26b3b7bac39763305ee1f0/0_118_3000_1800","cropRatio=3000,1800&size=140,500,1000,2000,3000","","A new entry on the list, partly because of his outstanding World Cup performances. He could make a case for having been England's best player in Russia and sparked bedlam across the country when he put the team in front with a precision free-kick against Croatia in the semi-final. The right-back emerged at the highest level when Spurs sold Kyle Walker to Manchester City in the summer of 2017, seeing off competition from Serge Aurier in the process, and <a href=""https://www.theguardian.com/football/2018/aug/25/kieran-trippier-stopped-in-m-and-s-tottenham-england-world-cup"">he has continued his progress</a> in 2018. His whipped deliveries are a major attacking weapon.","David Hytner","","","","","","Top 100 footballers 2017:the best talents in the world","The Guardian picks the best prospect from each club born between 1 September 2000 and 31 August 2001, an age band known as first-year scholars. Check the progress of our <a href=""https://www.theguardian.com/football/ng-interactive/2016/oct/04/next-generation-2016-20-of-the-best-talents-at-premier-league-clubs"" target=""_new"">2016 class</a> | <a href=""https://www.theguardian.com/football/ng-interactive/2015/oct/06/next-generation-2015-20-of-the-best-talents-at-premier-league-clubs"" target=""_new"">2015</a> | <a href=""https://www.theguardian.com/football/blog/ng-interactive/2014/oct/13/next-generation-2014-20-of-the-best-talents-at-premier-league-clubs"" target=""_new"">2014</a>","<a href=""https://www.theguardian.com/football"" target=""_new"">Football</a>",""
"73","71","-2","Ciro Immobile","Forward","Lazio","Italy","28","Italy","Italian, Serie A, Forwards","","","https://media.guim.co.uk/988396e8c4cc3bd02f491e70ffd89e85e93ba2a9/720_93_1102_1103","cropRatio=1102,1103&size=500,1000,1102","https://media.guim.co.uk/13aeea8f1241c3ed87e7e2b9e5b11efdb96cc6ee/0_31_2794_1677","cropRatio=2794,1677&size=140,500,1000,2000,2794","","Since sharing the title of Serie A’s capocannoniere with Mauro Icardi <a href=""https://www.theguardian.com/football/blog/2018/apr/14/rome-derby-roma-lazio-champions-league-place"">last season</a>, Immobile has already made it to double figures for Lazio again this term. His instinctive movement and opportunistic mindset make him a perfect fit for Simone Inzaghi’s counterattacking schemes, and at time of writing he averages a goal for every 109 minutes of club football played in 2018. He has not found the net for the national team since last September, however, and was dropped for a key Nations League game against Poland in October despite the absence of any natural No 9 to replace him.
","Paolo Bandini","","","","","","Top 100 footballers 2017:the best talents in the world","The Guardian picks the best prospect from each club born between 1 September 2000 and 31 August 2001, an age band known as first-year scholars. Check the progress of our <a href=""https://www.theguardian.com/football/ng-interactive/2016/oct/04/next-generation-2016-20-of-the-best-talents-at-premier-league-clubs"" target=""_new"">2016 class</a> | <a href=""https://www.theguardian.com/football/ng-interactive/2015/oct/06/next-generation-2015-20-of-the-best-talents-at-premier-league-clubs"" target=""_new"">2015</a> | <a href=""https://www.theguardian.com/football/blog/ng-interactive/2014/oct/13/next-generation-2014-20-of-the-best-talents-at-premier-league-clubs"" target=""_new"">2014</a>","<a href=""https://www.theguardian.com/football"" target=""_new"">Football</a>",""
"74","76","2","Thiago Silva","Defender","Paris St-Germain","France","34","Brazil","Brazilian, Ligue 1, Defenders","","","https://media.guim.co.uk/a2a7273c476d8ddca12b696b532c7c012e670429/591_19_987_987","cropRatio=987,987&size=140,500,987","https://media.guim.co.uk/adf2970b82cfa773d75fe922e4afa39e87c4b449/0_57_4206_2524","cropRatio=4206,2524&size=140,500,1000,2000,4206","","Time is running down on Thiago's spell at PSG, with his contract expiring in 2020 and suggestions swirling that he may depart as soon as next summer. He will turn 35 in September but remains a class act – a defender's defender who pursues the art of not conceding goals to the point of obsession but can play a bit, too. At times he has taken the rap for PSG's European failures and, in February, he was even dropped by Unai Emery for the <a href=""https://www.theguardian.com/football/2018/feb/14/real-madrid-paris-saint-germain-champions-league-last-16-first-leg-match-report"">Champions League round of 16 first leg against Real Madrid</a>. At some point he will be replaced for good by Presnel Kimpembe, his outstanding sidekick; for now the pair work well together and Silva, a passionate and dynamic leader for club and country, will surely have one more big move left in him when his time in France ends.
","Nick Ames","","","","","","Top 100 footballers 2017:the best talents in the world","The Guardian picks the best prospect from each club born between 1 September 2000 and 31 August 2001, an age band known as first-year scholars. Check the progress of our <a href=""https://www.theguardian.com/football/ng-interactive/2016/oct/04/next-generation-2016-20-of-the-best-talents-at-premier-league-clubs"" target=""_new"">2016 class</a> | <a href=""https://www.theguardian.com/football/ng-interactive/2015/oct/06/next-generation-2015-20-of-the-best-talents-at-premier-league-clubs"" target=""_new"">2015</a> | <a href=""https://www.theguardian.com/football/blog/ng-interactive/2014/oct/13/next-generation-2014-20-of-the-best-talents-at-premier-league-clubs"" target=""_new"">2014</a>","<a href=""https://www.theguardian.com/football"" target=""_new"">Football</a>",""
"75","","New entry","Thomas Meunier","Defender","Paris St-Germain","France","27","Belgium","Belgian, Ligue 1, Defenders","","","https://media.guim.co.uk/4041405fb6ded356cd90838cade562222608159b/1693_13_701_701","cropRatio=701,701&size=140,500,701","https://media.guim.co.uk/57d339e8cd6e9de04873e19c68378d030469f1f8/0_44_3864_2318","cropRatio=3864,2318&size=140,500,1000,2000,3864","","Meunier began his footballing life as a forward and, every now and again, it shows. He appeared on the edge of the six-yard box with the timing of a seasoned poacher to score Belgium’s opening goal in the World Cup third-place play-off against England and perhaps, had he not been suspended, they might have put in a more balanced display during the semi-final with France. An assist for Nacer Chadli’s dramatic winner over Japan had already helped them get that far and these moments are sound proof of where the galloping 27-year-old’s greatest strengths lie. A new entry to this list, he is in his element as a wing-back and has a galaxy of stars to combine with at both club and international levels, although with Dani Alves on the scene he has not always had things his own way at PSG.","Nick Ames","","","","","","Top 100 footballers 2017:the best talents in the world","The Guardian picks the best prospect from each club born between 1 September 2000 and 31 August 2001, an age band known as first-year scholars. Check the progress of our <a href=""https://www.theguardian.com/football/ng-interactive/2016/oct/04/next-generation-2016-20-of-the-best-talents-at-premier-league-clubs"" target=""_new"">2016 class</a> | <a href=""https://www.theguardian.com/football/ng-interactive/2015/oct/06/next-generation-2015-20-of-the-best-talents-at-premier-league-clubs"" target=""_new"">2015</a> | <a href=""https://www.theguardian.com/football/blog/ng-interactive/2014/oct/13/next-generation-2014-20-of-the-best-talents-at-premier-league-clubs"" target=""_new"">2014</a>","<a href=""https://www.theguardian.com/football"" target=""_new"">Football</a>",""
"76","45","-31","Leonardo Bonucci","Defender","Juventus","Italy","31","Italy","Italian, Serie A, Defenders","","","https://media.guim.co.uk/8e7248c8f070b07f5883cfadaadf18007369308c/1662_50_1816_1816","cropRatio=1816,1816&size=140,500,1000,1816","https://media.guim.co.uk/abc750efc40c99022c44f9ebcabd2615af634baf/0_58_3000_1800","cropRatio=3000,1800&size=140,500,1000,2000,3000","","After a disastrous season with Milan, Bonucci is <a href=""https://www.theguardian.com/football/2018/jul/31/gonzalo-higuain-milan-juventus-bonucci-returns"">back in his Juventus comfort zone</a>. Not that it might have felt all that comfortable to begin this season, with a portion of the team’s fanbase decrying him as a traitor and jeering his every touch at home games. He has begun to win those supporters back over with his performances, however, and especially with a goal that sealed victory <a href=""https://www.theguardian.com/football/blog/2018/oct/01/juventus-in-daunting-form-as-ronaldo-turns-provider-against-napoli"">over Napoli in September</a>. Defensively there have been missteps, but those look less glaring on a team with the quality to protect him, and Bonucci’s passing range is a huge asset going forward.","Paolo Bandini","","","","","","Top 100 footballers 2017:the best talents in the world","The Guardian picks the best prospect from each club born between 1 September 2000 and 31 August 2001, an age band known as first-year scholars. Check the progress of our <a href=""https://www.theguardian.com/football/ng-interactive/2016/oct/04/next-generation-2016-20-of-the-best-talents-at-premier-league-clubs"" target=""_new"">2016 class</a> | <a href=""https://www.theguardian.com/football/ng-interactive/2015/oct/06/next-generation-2015-20-of-the-best-talents-at-premier-league-clubs"" target=""_new"">2015</a> | <a href=""https://www.theguardian.com/football/blog/ng-interactive/2014/oct/13/next-generation-2014-20-of-the-best-talents-at-premier-league-clubs"" target=""_new"">2014</a>","<a href=""https://www.theguardian.com/football"" target=""_new"">Football</a>",""
"77","","New entry","Marcos Alonso","Defender","Chelsea","England","27","Spain","Spanish, Premier League, Defenders","","","https://media.guim.co.uk/36ba02b4d51ac5bd3a7c026ad2b8a7748e2023d3/1078_179_1595_1594","cropRatio=1595,1594&size=140,500,1000,1595","https://media.guim.co.uk/fdd8f0dcaf5457628f5334813738e85718628b92/0_228_3500_2100","cropRatio=3500,2100&size=140,500,1000,2000,3500","","A new entry in the Guardian’s list, there was a degree of scepticism when the former Bolton and Sunderland player was restored to the Premier League with Chelsea back in 2016, but Alonso has proved a key player under both Antonio Conte and Maurizio Sarri. He carries <a href=""https://www.theguardian.com/football/2018/aug/18/chelsea-arsenal-premier-league-match-report"">a potent goal threat</a> from left-back or left wing-back, can be vicious from dead-ball situations and, despite lacking explosive pace on the recovery, is improving defensively. It says much for his marked progress in 2018 that he has finally graduated into the senior Spain setup, with clubs back home taking notice of his progress.","Dominic Fifield","","","","","","Top 100 footballers 2017:the best talents in the world","The Guardian picks the best prospect from each club born between 1 September 2000 and 31 August 2001, an age band known as first-year scholars. Check the progress of our <a href=""https://www.theguardian.com/football/ng-interactive/2016/oct/04/next-generation-2016-20-of-the-best-talents-at-premier-league-clubs"" target=""_new"">2016 class</a> | <a href=""https://www.theguardian.com/football/ng-interactive/2015/oct/06/next-generation-2015-20-of-the-best-talents-at-premier-league-clubs"" target=""_new"">2015</a> | <a href=""https://www.theguardian.com/football/blog/ng-interactive/2014/oct/13/next-generation-2014-20-of-the-best-talents-at-premier-league-clubs"" target=""_new"">2014</a>","<a href=""https://www.theguardian.com/football"" target=""_new"">Football</a>",""
"78","","New entry","Son Heung-min","Forward","Tottenham Hotspur","England","26","South Korea","Other nationalities, Premier League, Forwards","","","https://media.guim.co.uk/f58606da0370510f26f93d341223fd23bf8ba0f8/1015_45_1839_1840","cropRatio=1839,1840&size=500,1000,1839","https://media.guim.co.uk/d3fa3f01c7b309dc101760c372b32c0a9e2052d9/0_73_4893_2936","cropRatio=4893,2936&size=140,500,1000,2000,4893","","Low maintenance, <a href=""https://www.theguardian.com/football/blog/2018/dec/05/son-heung-min-spurs-premier-league"">high-energy crowd favourite</a>, Son is arguably the biggest football star in Asia. Leaves everything out on the pitch and has become a consistent goal threat, finishing last season with 18 in all competitions for Spurs. This year has been hugely significant for the wide forward on the international stage. He scored twice at the World Cup finals for South Korea, including one <a href=""https://www.theguardian.com/football/blog/2018/dec/05/son-heung-min-spurs-premier-league"">as they eliminated Germany</a> at the group phase – although they themselves did not progress – while he led his country to <a href=""https://www.theguardian.com/football/2018/sep/01/son-heung-min-spared-military-service-south-korea-asian-games-gold"">victory at the Asian Games</a>, which earned him an exemption from military service.","David Hytner","","","","","","Top 100 footballers 2017:the best talents in the world","The Guardian picks the best prospect from each club born between 1 September 2000 and 31 August 2001, an age band known as first-year scholars. Check the progress of our <a href=""https://www.theguardian.com/football/ng-interactive/2016/oct/04/next-generation-2016-20-of-the-best-talents-at-premier-league-clubs"" target=""_new"">2016 class</a> | <a href=""https://www.theguardian.com/football/ng-interactive/2015/oct/06/next-generation-2015-20-of-the-best-talents-at-premier-league-clubs"" target=""_new"">2015</a> | <a href=""https://www.theguardian.com/football/blog/ng-interactive/2014/oct/13/next-generation-2014-20-of-the-best-talents-at-premier-league-clubs"" target=""_new"">2014</a>","<a href=""https://www.theguardian.com/football"" target=""_new"">Football</a>",""
"79","","New entry","Harry Maguire","Defender","Leicester City","England","25","England","English, Premier League, Defenders","","","https://media.guim.co.uk/1f278d5043a6c4036b74fc0feeeddc3983681b0b/1739_129_1100_1100","cropRatio=1100,1100&size=140,500,1000,1100","https://media.guim.co.uk/26a9dc7137573d6980c2159ef0dc8c7cb4088e10/0_115_5273_3164","cropRatio=5273,3164&size=140,500,1000,2000,5273","","Perhaps the best reminder of how far Maguire has come is the photo of him and his mates supporting England at Euro 2016. Two years later they were all at the World Cup following England again, only this time Maguire was playing. Not just playing but <a href=""https://www.theguardian.com/football/2018/jul/05/mosborough-moscow-england-harry-maguire-huge-source-pride"">excelling on the biggest stage</a>, where Maguire’s stellar performances at the heart of the England defence (as well as the size of his head and ability to ride inflatable unicorns) transformed his profile. A new entry on this list, the Yorkshireman <a href=""https://www.theguardian.com/football/2018/sep/09/harry-maguire-leicester-city-england-switzerland"">signed a five-year contract with Leicester</a> in September after being heavily linked with Manchester United.","Stuart James","","","","","","Top 100 footballers 2017:the best talents in the world","The Guardian picks the best prospect from each club born between 1 September 2000 and 31 August 2001, an age band known as first-year scholars. Check the progress of our <a href=""https://www.theguardian.com/football/ng-interactive/2016/oct/04/next-generation-2016-20-of-the-best-talents-at-premier-league-clubs"" target=""_new"">2016 class</a> | <a href=""https://www.theguardian.com/football/ng-interactive/2015/oct/06/next-generation-2015-20-of-the-best-talents-at-premier-league-clubs"" target=""_new"">2015</a> | <a href=""https://www.theguardian.com/football/blog/ng-interactive/2014/oct/13/next-generation-2014-20-of-the-best-talents-at-premier-league-clubs"" target=""_new"">2014</a>","<a href=""https://www.theguardian.com/football"" target=""_new"">Football</a>",""
"80","","New entry","Kyle Walker","Defender","Manchester City","England","28","England","English, Premier League, Defenders","","","https://media.guim.co.uk/b099dde1559edb9cbb69622dca0c0b224974f49a/1065_95_675_675","cropRatio=675,675&size=140,500,675","https://media.guim.co.uk/82296d6d69e3d59ff9fbf5d89fed258a5e3ef0df/826_1106_3032_1930","cropRatio=3032,1930&size=140,500,1000,2000,3032","","The 28-year-old’s form this year gives him a strong case to be considered the finest right-back in the world and one of the most complete defenders, given his performances as <a href=""https://www.theguardian.com/football/2018/may/26/kyle-walker-england-world-cup-huge-steps"">a centre-back for Gareth Southgate’s three-man England back line</a>. Walker was a revelation in that role as the team reached the semi-finals in Russia. His serious pace means one criticism is that he should perhaps be a more potent creative force and, if he can add that to his armoury, then next year a top 50 place may be within his grasp.","Jamie Jackson","","","","","","Top 100 footballers 2017:the best talents in the world","The Guardian picks the best prospect from each club born between 1 September 2000 and 31 August 2001, an age band known as first-year scholars. Check the progress of our <a href=""https://www.theguardian.com/football/ng-interactive/2016/oct/04/next-generation-2016-20-of-the-best-talents-at-premier-league-clubs"" target=""_new"">2016 class</a> | <a href=""https://www.theguardian.com/football/ng-interactive/2015/oct/06/next-generation-2015-20-of-the-best-talents-at-premier-league-clubs"" target=""_new"">2015</a> | <a href=""https://www.theguardian.com/football/blog/ng-interactive/2014/oct/13/next-generation-2014-20-of-the-best-talents-at-premier-league-clubs"" target=""_new"">2014</a>","<a href=""https://www.theguardian.com/football"" target=""_new"">Football</a>",""
"81","39","-42","Gabriel Jesus","Forward","Manchester City","England","21","Brazil","Brazilian, Premier League, Forwards","","","https://media.guim.co.uk/21e449fa69425cee9ad5960353382406ae04d9df/1889_244_1358_1358","cropRatio=1358,1358&size=140,500,1000,1358","https://media.guim.co.uk/0c5be1f5865045dbda2afe8908d9efeb220ec001/1564_1053_3620_2172","cropRatio=3620,2172&size=140,500,1000,2000,3620","","A drop of 42 places from 2017 shows just how disappointing Jesus’s year has been. The striker did score 13 league goals last season but has just a handful of goals this campaign and he was also goalless at the World Cup despite being Brazil’s centre-forward. Pep Guardiola dropped him for the defeat at Chelsea – a significant move that came despite Sergio Agüero being ruled out with injury. When brought off the bench, Jesus failed to score as City suffered a first league defeat. The 21-year-old has been troubled by injuries of his own – <a href=""https://www.theguardian.com/football/2018/jan/01/gabriel-jesus-manchester-city-knee-ligament-injury"">a knee problem ruled him out</a> from January to late February – and he has not recaptured his finest form since. Two goals against Everton in mid-December, however, showed that he may be about to recapture his best form. ","Jamie Jackson","","","","","","Top 100 footballers 2017:the best talents in the world","The Guardian picks the best prospect from each club born between 1 September 2000 and 31 August 2001, an age band known as first-year scholars. Check the progress of our <a href=""https://www.theguardian.com/football/ng-interactive/2016/oct/04/next-generation-2016-20-of-the-best-talents-at-premier-league-clubs"" target=""_new"">2016 class</a> | <a href=""https://www.theguardian.com/football/ng-interactive/2015/oct/06/next-generation-2015-20-of-the-best-talents-at-premier-league-clubs"" target=""_new"">2015</a> | <a href=""https://www.theguardian.com/football/blog/ng-interactive/2014/oct/13/next-generation-2014-20-of-the-best-talents-at-premier-league-clubs"" target=""_new"">2014</a>","<a href=""https://www.theguardian.com/football"" target=""_new"">Football</a>",""
"82","","New entry","James Milner","Midfielder","Liverpool","England","32","England","English, Premier League, Midfielders","","","https://media.guim.co.uk/291459291c619116aa0711556b4cdd90c4884b06/663_107_1172_1172","cropRatio=1172,1172&size=140,500,1000,1172","https://media.guim.co.uk/e1bf29427371a050ba960f34e3950eba104916ef/330_365_3543_2126","cropRatio=3543,2126&size=140,500,1000,2000,3543","","The ""Boring Milner"" image is not the only thing Liverpool’s seasoned midfielder has made a complete mockery of. At 32, and with competition increasing at the heart of a team with Premier League title ambitions, it would be understandable for Milner’s influence to be on the wane. The opposite has occurred in Jürgen Klopp’s midfield. Milner ended last season having provided the most assists in a single Champions League campaign – nine, bettering returns from players <a href=""https://www.theguardian.com/football/blog/2018/apr/25/james-milner-liverpool-in-vogue-barney-ronay"">such as Neymar, Xavi and Andrés Iniesta</a> – yet both his form and importance have risen during Liverpool’s commanding start to the current league campaign.","Andy Hunter","","","","","","Top 100 footballers 2017:the best talents in the world","The Guardian picks the best prospect from each club born between 1 September 2000 and 31 August 2001, an age band known as first-year scholars. Check the progress of our <a href=""https://www.theguardian.com/football/ng-interactive/2016/oct/04/next-generation-2016-20-of-the-best-talents-at-premier-league-clubs"" target=""_new"">2016 class</a> | <a href=""https://www.theguardian.com/football/ng-interactive/2015/oct/06/next-generation-2015-20-of-the-best-talents-at-premier-league-clubs"" target=""_new"">2015</a> | <a href=""https://www.theguardian.com/football/blog/ng-interactive/2014/oct/13/next-generation-2014-20-of-the-best-talents-at-premier-league-clubs"" target=""_new"">2014</a>","<a href=""https://www.theguardian.com/football"" target=""_new"">Football</a>",""
