"sheets.players.Rank","sheets.players.Last.year","sheets.players.Up.or.down","sheets.players.Name","sheets.players.Position","sheets.players.Club.on.20.Dec.2018","sheets.players.League","sheets.players.Age.on.20.Dec.2018","sheets.players.Nationality","sheets.players.Filters","sheets.players.Image.found","sheets.players.Video.Path","sheets.players.Facewall.cell.image.GRID.src","sheets.players.Facewall.cell.image.GRID.attributes","sheets.players.Facewall.main.image.GRID.src","sheets.players.Facewall.main.image.GRID.attributes","sheets.players.","sheets.players.Profile","sheets.players.Writer","sheets.players.Words","sheets.players.Desked.by","sheets.players.To.be.subbed.by","sheets.players.Subbed","sheets.players.Revised","sheets.furniture.headline","sheets.furniture.standfirst","sheets.furniture.pagestrap","sheets.furniture.shareurl"
"47","","Re-entry","Marco Reus","Forward","Borussia Dortmund","Germany","29","Germany","German, Bundesliga, Forwards","","","https://media.guim.co.uk/bb4077e785e822b6a4498e23858bb486d434318f/2138_350_880_880","cropRatio=880,880&size=140,500,880","https://media.guim.co.uk/bb4077e785e822b6a4498e23858bb486d434318f/0_256_4905_2943","cropRatio=4905,2943&size=140,500,1000,2000,4905","","It seemed a big ask for Reus to return to his scintillating best after the run of long-term injuries that blighted the peak years of his career; it seemed a long shot, too, for Borussia Dortmund to dominate this season’s Bundesliga after more than half a decade in Bayern Munich’s slipstream. What a thrill, then, to see both on such sensational form in recent months. Reus looks a player reborn, a string of decisive and utterly lethal performances helping lift Lucien Favre’s compelling side clear at the summit. A rapier-like finish in the <a href=""https://www.theguardian.com/football/2018/nov/10/borussia-dortmund-bayern-munich-bundesliga-match-report"">3-2 win over Bayern</a>, later added to with a penalty, embodied Reus at his best: he can hurt you from anywhere and the only regret is that he could, should, have been one of the world’s top few players for years on end. He returns to our list after a two-year absence, <a href=""https://www.theguardian.com/football/ng-interactive/2015/dec/21/the-100-best-footballers-in-the-world-2015-interactive"">having been No 50 in 2015</a>, and at least we are now able to enjoy him in full flight once again.","Nick Ames","MC√","JA","JA","NA","","Top 100 footballers 2017:the best talents in the world","The Guardian picks the best prospect from each club born between 1 September 2000 and 31 August 2001, an age band known as first-year scholars. Check the progress of our <a href=""https://www.theguardian.com/football/ng-interactive/2016/oct/04/next-generation-2016-20-of-the-best-talents-at-premier-league-clubs"" target=""_new"">2016 class</a> | <a href=""https://www.theguardian.com/football/ng-interactive/2015/oct/06/next-generation-2015-20-of-the-best-talents-at-premier-league-clubs"" target=""_new"">2015</a> | <a href=""https://www.theguardian.com/football/blog/ng-interactive/2014/oct/13/next-generation-2014-20-of-the-best-talents-at-premier-league-clubs"" target=""_new"">2014</a>","<a href=""https://www.theguardian.com/football"" target=""_new"">Football</a>",""
"48","51","3","Karim Benzema","Forward","Real Madrid","Spain","31","France","French, La Liga, Forwards","","","https://media.guim.co.uk/2d2ed3908a6f8b44808aba7a4c75081f43d240b4/904_71_2160_2161","cropRatio=2160,2161&size=500,1000,2000,2160","https://media.guim.co.uk/02422af8dfd342688e48728bc44ec9def467444e/381_75_2694_1617","cropRatio=2694,1617&size=140,500,1000,2000,2694","","No one hangs around at the Bernabéu for 10 years if they’re not really, really good at football – and Karim Benzema is really, really good at football. The thing is, some don’t see it. Others, meanwhile, demand more. More goals, especially. Last season his contribution was limited although he did score in <a href=""https://www.theguardian.com/football/2018/may/01/real-madrid-bayern-munich-champions-league-match-report"">the semi-final</a> and the <a href=""https://www.theguardian.com/football/2018/may/26/real-madrid-liverpool-champions-league-final-match-report"">final of the Champions League</a>, assisted by two barely-believable goalkeeping errors. And anyway, Benzema thinks they’re missing the point: “People don’t understand what I do on the pitch,” he says.","Sid Lowe","SMc√","JA","JA","NA","","Top 100 footballers 2017:the best talents in the world","The Guardian picks the best prospect from each club born between 1 September 2000 and 31 August 2001, an age band known as first-year scholars. Check the progress of our <a href=""https://www.theguardian.com/football/ng-interactive/2016/oct/04/next-generation-2016-20-of-the-best-talents-at-premier-league-clubs"" target=""_new"">2016 class</a> | <a href=""https://www.theguardian.com/football/ng-interactive/2015/oct/06/next-generation-2015-20-of-the-best-talents-at-premier-league-clubs"" target=""_new"">2015</a> | <a href=""https://www.theguardian.com/football/blog/ng-interactive/2014/oct/13/next-generation-2014-20-of-the-best-talents-at-premier-league-clubs"" target=""_new"">2014</a>","<a href=""https://www.theguardian.com/football"" target=""_new"">Football</a>",""
"49","56","7","Giorgio Chiellini","Defender","Juventus","Italy","34","Italy","Italian, Serie A, Defenders","","","https://media.guim.co.uk/db3d2a4022bdaafde8afc59e3ea6295fd288f9a1/884_167_968_968","cropRatio=968,968&size=140,500,968","https://media.guim.co.uk/9fb4f95319694ef66837fdaed48c4ab0261845f2/0_100_3000_1800","cropRatio=3000,1800&size=140,500,1000,2000,3000","","Amid the media spectacle of Cristiano Ronaldo’s <a href=""<a href=""https://www.theguardian.com/football/2018/jul/16/cristiano-ronaldo-joins-juventus-real-madrid-portugal-turin"">unveiling at Juventus this summer</a> came a rare human moment when he ran into Chiellini for the first time at the club’s Continassa training facility. The five-time Ballon d’Or winner extended a polite hand in greeting; the Italian ignored it and went in for a bear hug. Wearing the captain’s armband this season following the departure of Gigi Buffon, Chiellini remains the same down-to-earth leader that he always was, and the same brilliant defender as well. He won his 100th cap for Italy in November and intends to add plenty more yet. ","Paolo Bandini","MC√","NA","NA","JA","","Top 100 footballers 2017:the best talents in the world","The Guardian picks the best prospect from each club born between 1 September 2000 and 31 August 2001, an age band known as first-year scholars. Check the progress of our <a href=""https://www.theguardian.com/football/ng-interactive/2016/oct/04/next-generation-2016-20-of-the-best-talents-at-premier-league-clubs"" target=""_new"">2016 class</a> | <a href=""https://www.theguardian.com/football/ng-interactive/2015/oct/06/next-generation-2015-20-of-the-best-talents-at-premier-league-clubs"" target=""_new"">2015</a> | <a href=""https://www.theguardian.com/football/blog/ng-interactive/2014/oct/13/next-generation-2014-20-of-the-best-talents-at-premier-league-clubs"" target=""_new"">2014</a>","<a href=""https://www.theguardian.com/football"" target=""_new"">Football</a>",""
"50","46","-4","Sergio Busquets","Midfielder","Barcelona","Spain","30","Spain","Spanish, La Liga, Midfielders","","","https://media.guim.co.uk/8d017913c3f56aa96369196a88eb83d11bf2cc33/610_38_1118_1118","cropRatio=1118,1118&size=140,500,1000,1118","https://media.guim.co.uk/0ef2de185f9e3904e3bacc4d03fd108579ce95bf/0_347_4448_2669","cropRatio=4448,2669&size=140,500,1000,2000,4448","","Not long ago Pep Guardiola revealed what Leo Messi thought the first time he saw Busquets in training, a line that was telling in its simplicity. ""I like this guy,"" Messi said. Guardiola replied: ""Whenever we have problems, he’ll be there."" <a href=""https://www.theguardian.com/football/blog/2016/feb/24/sergio-busquets-barcelona-arsenal"">The last man standing</a> of ""that"" midfield, a defender of Barcelona’s footballing faith. Although it is true that he is slowing down, sometimes more exposed than he would like, caught more than he once was, there may be no one quite like him.","Sid Lowe","SMc√","JA","JA","NA","","Top 100 footballers 2017:the best talents in the world","The Guardian picks the best prospect from each club born between 1 September 2000 and 31 August 2001, an age band known as first-year scholars. Check the progress of our <a href=""https://www.theguardian.com/football/ng-interactive/2016/oct/04/next-generation-2016-20-of-the-best-talents-at-premier-league-clubs"" target=""_new"">2016 class</a> | <a href=""https://www.theguardian.com/football/ng-interactive/2015/oct/06/next-generation-2015-20-of-the-best-talents-at-premier-league-clubs"" target=""_new"">2015</a> | <a href=""https://www.theguardian.com/football/blog/ng-interactive/2014/oct/13/next-generation-2014-20-of-the-best-talents-at-premier-league-clubs"" target=""_new"">2014</a>","<a href=""https://www.theguardian.com/football"" target=""_new"">Football</a>",""
"51","85","34","Miralem Pjanic","Midfielder","Juventus","Italy","28","Bosnia-Herzegovina","Other nationalities, Serie A, Midfielders","","","https://media.guim.co.uk/ce87311260bffb12a9782ed169d2496620268f8a/1937_130_1409_1410","cropRatio=1409,1410&size=500,1000,1409","https://media.guim.co.uk/f7200f6946bf0ab3c539a9c13f88fd732e32db7c/0_166_3000_1800","cropRatio=3000,1800&size=140,500,1000,2000,3000","","The <a href=""https://www.theguardian.com/football/2018/oct/21/miralem-pjanic-bosnia-juventus-manchester-united-champions-league"">conductor of Juventus’s orchestra</a>, Pjanic is the man whose understated work in the middle of the pitch allows the soloists around him to shine. His 34-place climb up these rankings is not premised on any single eye-catching performance – Bosnia’s failure to qualify for the World Cup denied him the opportunity to dazzle us in Russia – so much as a broadening appreciation of his constancy in a Bianconeri side that has changed significantly around him over the past three years. The only regret this season is that, with Cristiano Ronaldo’s arrival, we are seeing him take fewer of his brilliant free-kicks.","Paolo Bandini","SMc√","NA","NA","JA√","","Top 100 footballers 2017:the best talents in the world","The Guardian picks the best prospect from each club born between 1 September 2000 and 31 August 2001, an age band known as first-year scholars. Check the progress of our <a href=""https://www.theguardian.com/football/ng-interactive/2016/oct/04/next-generation-2016-20-of-the-best-talents-at-premier-league-clubs"" target=""_new"">2016 class</a> | <a href=""https://www.theguardian.com/football/ng-interactive/2015/oct/06/next-generation-2015-20-of-the-best-talents-at-premier-league-clubs"" target=""_new"">2015</a> | <a href=""https://www.theguardian.com/football/blog/ng-interactive/2014/oct/13/next-generation-2014-20-of-the-best-talents-at-premier-league-clubs"" target=""_new"">2014</a>","<a href=""https://www.theguardian.com/football"" target=""_new"">Football</a>",""
"52","","New entry","Jorginho","Midfielder","Chelsea","England","27","Italy","Italian, Premier League, Midfielders","","","https://media.guim.co.uk/5c8429ec3ce2b2c488fd38ed8359c1c556a1533f/525_51_705_705","cropRatio=705,705&size=140,500,705","https://media.guim.co.uk/f04beb0d31c543e4b9931e872977c2c8270110d3/0_272_3500_2100","cropRatio=3500,2100&size=140,500,1000,2000,3500","","The Italy midfielder is the cog around which Maurizio Sarri’s Napoli turned, with the player duly following the head coach to Stamford Bridge over the summer. The compensation for Sarri’s switch was actually included in <a href=""https://www.theguardian.com/football/2018/aug/04/maurizio-sarri-chelsea-jorginho-manchester-city-pep-guardiola"">the £57m transfer fee paid for the 27-year-old</a>. Everything goes through him, whether he is collecting from his centre-halves or <a href=""https://www.theguardian.com/football/blog/2018/sep/23/jorginho-chelsea-west-ham"">prompting those further up the field</a>. No one can match his pass rate in the Premier League, though Jorginho will have to learn to cope with the better teams swarming all over him if he is to remain effective in his team’s key games. Close him down and Chelsea are stymied.","Dominic Fifield","SMc√","JA","JA","NA","","Top 100 footballers 2017:the best talents in the world","The Guardian picks the best prospect from each club born between 1 September 2000 and 31 August 2001, an age band known as first-year scholars. Check the progress of our <a href=""https://www.theguardian.com/football/ng-interactive/2016/oct/04/next-generation-2016-20-of-the-best-talents-at-premier-league-clubs"" target=""_new"">2016 class</a> | <a href=""https://www.theguardian.com/football/ng-interactive/2015/oct/06/next-generation-2015-20-of-the-best-talents-at-premier-league-clubs"" target=""_new"">2015</a> | <a href=""https://www.theguardian.com/football/blog/ng-interactive/2014/oct/13/next-generation-2014-20-of-the-best-talents-at-premier-league-clubs"" target=""_new"">2014</a>","<a href=""https://www.theguardian.com/football"" target=""_new"">Football</a>",""
"53","","Re-entry","Blaise Matuidi","Midfielder","Juventus","Italy","31","France","French, Serie A, Midfielders","","","https://media.guim.co.uk/492ed5b9b9c8beef5f1746e6ce2a00c697575fb3/441_74_828_827","cropRatio=828,827&size=140,500,828","https://media.guim.co.uk/585b16f99872181cc12645ed14e86665454c1e0a/0_160_4652_2792","cropRatio=4652,2792&size=140,500,1000,2000,4652","","His reappearance in the top 100 reflects how well he responded to leaving Paris Saint-Germain, where some said he was washed up. Instead Matuidi enjoyed the best season of his career, helping Juventus to a domestic double before playing a key role in France’s World Cup triumph. The dynamism and intelligence he showed after being introduced to the starting lineup for <a href=""https://www.theguardian.com/football/2018/jun/21/france-peru-world-cup-group-c-match-report"">France’s second match of that campaign</a> gave the team balance and helped bring the best out of Kylian Mbappé and Paul Pogba, in particular. Matuidi became so vital that France successfully appealed against a yellow card to ensure he could <a href=""https://www.theguardian.com/football/2018/jul/10/france-belgium-world-cup-semi-final-match-report"">play in the semi-final</a>.","Paul Doyle","SMc√","JA","JA","NA","","Top 100 footballers 2017:the best talents in the world","The Guardian picks the best prospect from each club born between 1 September 2000 and 31 August 2001, an age band known as first-year scholars. Check the progress of our <a href=""https://www.theguardian.com/football/ng-interactive/2016/oct/04/next-generation-2016-20-of-the-best-talents-at-premier-league-clubs"" target=""_new"">2016 class</a> | <a href=""https://www.theguardian.com/football/ng-interactive/2015/oct/06/next-generation-2015-20-of-the-best-talents-at-premier-league-clubs"" target=""_new"">2015</a> | <a href=""https://www.theguardian.com/football/blog/ng-interactive/2014/oct/13/next-generation-2014-20-of-the-best-talents-at-premier-league-clubs"" target=""_new"">2014</a>","<a href=""https://www.theguardian.com/football"" target=""_new"">Football</a>",""
"54","43","-11","Edin Dzeko","Forward","Roma","Italy","32","Bosnia-Herzegovina","Other nationalities, Serie A, Forwards","","","https://media.guim.co.uk/cb16c809d2eec3cc40527ef9dd1a2d8ee9f96d5d/862_39_792_792","cropRatio=792,792&size=140,500,792","https://media.guim.co.uk/11bbd2be74d41074fa12393920504639a0ba0b37/0_152_3811_2286","cropRatio=3811,2286&size=140,500,1000,2000,3811","","No wonder <a href=""https://www.theguardian.com/football/2018/jan/24/chelsea-agree-44m-transfer-deal-edin-dzeko-emerson-palmieri"">Chelsea wanted to sign Dzeko</a> in January. After turning down a move to west London, the Roma striker put together a barnstorming second half of the season: <a href=""https://www.theguardian.com/football/blog/2018/apr/15/roma-edin-dzeko-standard-bearer-premier-league"">firing his team to a Champions League semi-final</a> with goals in five out of six knockout games. In just his fourth campaign with the Giallorossi, Dzeko already ranks among the club’s top 10 scorers of all time, and has credited the man in first place, Francesco Totti, with making him better. “I only wish I had come here sooner,” said Dzeko recently. “He could have helped me to score even more.”","Paolo Bandini","SMc√","JA","JA","NA","","Top 100 footballers 2017:the best talents in the world","The Guardian picks the best prospect from each club born between 1 September 2000 and 31 August 2001, an age band known as first-year scholars. Check the progress of our <a href=""https://www.theguardian.com/football/ng-interactive/2016/oct/04/next-generation-2016-20-of-the-best-talents-at-premier-league-clubs"" target=""_new"">2016 class</a> | <a href=""https://www.theguardian.com/football/ng-interactive/2015/oct/06/next-generation-2015-20-of-the-best-talents-at-premier-league-clubs"" target=""_new"">2015</a> | <a href=""https://www.theguardian.com/football/blog/ng-interactive/2014/oct/13/next-generation-2014-20-of-the-best-talents-at-premier-league-clubs"" target=""_new"">2014</a>","<a href=""https://www.theguardian.com/football"" target=""_new"">Football</a>",""
"55","21","-34","Pierre-Emerick Aubameyang","Forward","Arsenal","England","29","Gabon","Other nationalities, Premier League, Forwards","","","https://media.guim.co.uk/5e9dac76a68d25a7ab0e234f6816c88f3319ce19/1356_81_2619_2620","cropRatio=2619,2620&size=500,1000,2000,2619","https://media.guim.co.uk/0df9b750fc1471ff41fadba292d7f25eaf21b238/0_86_3000_1800","cropRatio=3000,1800&size=140,500,1000,2000,3000","","Maybe there is something afoot with the Best League In The World™ if Aubameyang has fallen 34 places on this list despite being one of the Premier League’s most prolific strikers since he <a href=""https://www.theguardian.com/football/2018/jan/31/pierre-emerick-aubameyang-joins-arsenal-deadline-day-transfer"">moved from Dortmund to Arsenal in January</a>. Perhaps there is a question of whether Unai Emery could get more out of him as he is sometimes fielded wide. Enjoying his football, he is still a superb force in front of goal, as he has proved in recent weeks with an array of different finishes from inside and outside the box.","Amy Lawrence","SMc√","JA","JA","NA","","Top 100 footballers 2017:the best talents in the world","The Guardian picks the best prospect from each club born between 1 September 2000 and 31 August 2001, an age band known as first-year scholars. Check the progress of our <a href=""https://www.theguardian.com/football/ng-interactive/2016/oct/04/next-generation-2016-20-of-the-best-talents-at-premier-league-clubs"" target=""_new"">2016 class</a> | <a href=""https://www.theguardian.com/football/ng-interactive/2015/oct/06/next-generation-2015-20-of-the-best-talents-at-premier-league-clubs"" target=""_new"">2015</a> | <a href=""https://www.theguardian.com/football/blog/ng-interactive/2014/oct/13/next-generation-2014-20-of-the-best-talents-at-premier-league-clubs"" target=""_new"">2014</a>","<a href=""https://www.theguardian.com/football"" target=""_new"">Football</a>",""
"56","","New entry","Kalidou Koulibaly","Defender","Napoli","Italy","27","Senegal","Other nationalities, Serie A, Defenders","","","https://media.guim.co.uk/589d0a09dedd0325d3379fd6f4190e4a7da5fea8/515_974_1233_1233","cropRatio=1233,1233&size=140,500,1000,1233","https://media.guim.co.uk/16f5414c20c60fe08139f690d759a3fc3f12aac3/0_129_3600_2161","cropRatio=3600,2161&size=140,500,1000,2000,3600","","As Kylian Mbappé sprinted towards goal during <a href=""https://www.theguardian.com/football/2018/nov/06/champions-league-roundup-lorenzo-insigne-napoli-psg"">PSG’s trip to Napoli in the Champions League</a>, the striker thought he would soon be clean through. But Koulibaly kept pace with him before nicking the ball with a perfect tackle. It was a telling moment: one of the best attackers on the planet foiled by one of the best defenders. “It was either him or me,” said Koulibaly later. “If he’d got past me people wouldn’t have stopped talking about it.” Getting past the Senegal international is indeed a feat to boast about, for he is a colossus. But he is also a tidy builder from the back and a constant threat from set-pieces.","Paul Doyle","SMc√","JA","JA","NA","","Top 100 footballers 2017:the best talents in the world","The Guardian picks the best prospect from each club born between 1 September 2000 and 31 August 2001, an age band known as first-year scholars. Check the progress of our <a href=""https://www.theguardian.com/football/ng-interactive/2016/oct/04/next-generation-2016-20-of-the-best-talents-at-premier-league-clubs"" target=""_new"">2016 class</a> | <a href=""https://www.theguardian.com/football/ng-interactive/2015/oct/06/next-generation-2015-20-of-the-best-talents-at-premier-league-clubs"" target=""_new"">2015</a> | <a href=""https://www.theguardian.com/football/blog/ng-interactive/2014/oct/13/next-generation-2014-20-of-the-best-talents-at-premier-league-clubs"" target=""_new"">2014</a>","<a href=""https://www.theguardian.com/football"" target=""_new"">Football</a>",""
"57","61","4","Leroy Sané","Forward","Manchester City","England","22","Germany","German, Premier League, Forwards","","","https://media.guim.co.uk/130736cba6adf454237b7c13f2e9be6dc74db9db/135_251_2578_2578","cropRatio=2578,2578&size=140,500,1000,2000,2578","https://media.guim.co.uk/e5df6b8cba613f8477082774207adcb009ac4115/167_190_5219_3135","cropRatio=5219,3135&size=140,500,1000,2000,5219","","If Sané continues to mature he may overtake Raheem Sterling, Kevin De Bruyne, David Silva and Sergio Agüero as the star attraction in Manchester City's constellation. The German is not always a first choice for Pep Guardiola yet it is rare for him to endure a day when he is not terrorising the opposing right-back with his pace and dazzling feet. Sané was superb in the second half of City’s championship procession so Joachim Löw’s decision to <a href=""https://www.theguardian.com/football/2018/jun/04/germany-leroy-sane-world-cup-squad"">leave the 22-year-old out of Germany’s World Cup squad</a> was a serious surprise.","Jamie Jackson","SMc√","JA","JA","NA","","Top 100 footballers 2017:the best talents in the world","The Guardian picks the best prospect from each club born between 1 September 2000 and 31 August 2001, an age band known as first-year scholars. Check the progress of our <a href=""https://www.theguardian.com/football/ng-interactive/2016/oct/04/next-generation-2016-20-of-the-best-talents-at-premier-league-clubs"" target=""_new"">2016 class</a> | <a href=""https://www.theguardian.com/football/ng-interactive/2015/oct/06/next-generation-2015-20-of-the-best-talents-at-premier-league-clubs"" target=""_new"">2015</a> | <a href=""https://www.theguardian.com/football/blog/ng-interactive/2014/oct/13/next-generation-2014-20-of-the-best-talents-at-premier-league-clubs"" target=""_new"">2014</a>","<a href=""https://www.theguardian.com/football"" target=""_new"">Football</a>",""
"58","44","-14","Lorenzo Insigne","Forward","Napoli","Italy","27","Italy","Italian, Serie A, Forwards","","","https://media.guim.co.uk/12b51763806ab15bc0cff748c049b3f0cbe433a5/657_77_661_660","cropRatio=661,660&size=140,500,661","https://media.guim.co.uk/ceb3c8c833e65bf2d3f3eca70f035f672a37f364/0_33_762_457","cropRatio=762,457&size=140,500,762","","Of all the tactical tweaks made by Carlo Ancelotti so far at Napoli, the decision to move Insigne into the centre of his attack looks like the most inspired. Already deadly from the left wing, the 27-year-old has only become more prolific now that he is playing closer to goal, and he <a href=""https://www.theguardian.com/football/2018/oct/03/napoli-liverpool-champions-league-match-report"">punctured both Liverpool</a> and <a href=""https://www.theguardian.com/football/2018/nov/06/champions-league-roundup-lorenzo-insigne-napoli-psg"">Paris Saint-Germain during the Champions League group stage</a>. His 14-place slide down these rankings likely owes something to <a href=""https://www.theguardian.com/football/the-gentleman-ultra/2018/mar/27/italy-world-cup-2018-england-russia-future"">Italy’s absence from the World Cup</a>, but Insigne has already assumed an integral role for the Azzurri under Roberto Mancini.
","Paolo Bandini","SMc√","JA","JA","NA","","Top 100 footballers 2017:the best talents in the world","The Guardian picks the best prospect from each club born between 1 September 2000 and 31 August 2001, an age band known as first-year scholars. Check the progress of our <a href=""https://www.theguardian.com/football/ng-interactive/2016/oct/04/next-generation-2016-20-of-the-best-talents-at-premier-league-clubs"" target=""_new"">2016 class</a> | <a href=""https://www.theguardian.com/football/ng-interactive/2015/oct/06/next-generation-2015-20-of-the-best-talents-at-premier-league-clubs"" target=""_new"">2015</a> | <a href=""https://www.theguardian.com/football/blog/ng-interactive/2014/oct/13/next-generation-2014-20-of-the-best-talents-at-premier-league-clubs"" target=""_new"">2014</a>","<a href=""https://www.theguardian.com/football"" target=""_new"">Football</a>",""
